	post	class	original_id
1275	@tedlieu @WhiteHouse @USChamber Dr. Oz says he's looking for war time hero's... Are you a war time hero, or a menace to this Chinese Virus... I would advise you to stand your post Ted and help America and the American people... Ask not what your country can do for you, but what you can do for your country.	0	1244805281860800515
1276	@ImtiazMadmood @ShubhraBajpai4 Ur defying all logic and hope so with ideology ur community in confidence should not… https://t.co/q5Qxn15hL6	0	1226700759145730048
1277	It looks like he’s just won Big Brother 1	0	1230596312107798528
1278	Oh okay so NOW every news agency is allowed to report that the Coronavirus is man-made but when ZeroHedge said it two weeks ago — @Twitter banned their fucking account. https://t.co/WRTFVWajG1	0	1230546342293860357
1279	Watching 'Race and Coronavirus: A Bay Area Conversation.' ABC7 is confronting hate crimes against Asian Americans during the COVID-19 pandemic with an interactive town hall. I see @JMGarcel of @LatinoCommFdn #ally #WashTheHate https://t.co/nzsXbB4Pl2	1	1245853948268838913
1280	@KernoNowell @Braveheart_USA Yep, this is the 5th strain. The flu kills over 60,000 people a year in the United States and they're concerned about the coronavirus? The US isn't a third world country like China with citizens who have poor health, sanitation, and healthcare.	0	1233599433947807745
1281	If you let the #ChineseVirus establish a Critical Mass in a High Density Area... the benefits of Seasonal Change in SLOWING the Spread will be diminished Be Aggressive Early Slow the Spread Buy Time Your area does NOT need to be #NYC (they Fucked up big time) https://t.co/n6NlWcYxwG	0	1245036209593868294
1282	@KGar22 @galencwatson @RNCResearch @NVGOP @SpeakerPelosi @SenSchumer @BarackObama WRONG  Flights were STILL coming in.   #China sent #WuhanVirus to America until we shut them down  AND LIBERALS LIKE YOU CALLED HIM A RACIST FOR IT  BTW you leftist STILL called him a racist; which is the point!	0	1245141132297809920
1283	@AOC @AOC What the fuck are you rambling on about now!? Sit down, shut the fuck up, &amp; Suck start a .45. Let the professionals take care of everything. Your a spoild privileged little girl who bitches and complains, &amp; wont do shit yourself to help others. #COVID19 #FakeNews #WuhanVirus	0	1246288852865691650
1284	@PDChina @China_Amb_India Fucking asshole , put the whole world in panic mode . China should pay reparations to all countries #ChinaVirus	2	1246315363710582784
1285	"Trump’s retard. But fuck Chinese communists! I used to pile on people for calling it ""Chinese Virus"". It is fucking ""Chinese Virus""! Chinese knew about this contagious virus early on, tried to muzzle those who red flagged it; &amp; made them die. Families of all dead must sue Chinese"	2	1245401659724967936
1286	n ppl tried to come at me saying “stop calling it da chinese virus” when they created da shit even after governments stopped funding those dangerous ass trials. look stupid n defend da chinese if u want, they wanted dis to happen.	2	1245350969594036225
1287	I’d like to share what it’s like on board the Diamond Princess cruise. Please use this page to exchange info. #DiamondPrincess #coronavirus https://t.co/wRLdy63suj	0	1230621431853006848
1288	Why a coronavirus diagnosis is not a certain death sentence and more coronavirus myths debunked https://t.co/qgbbS4Nw24	0	1230525905270984705
1289	We cannot stand by while hatred goes viral. With the spread of #COVID19, there's been over 650 reported racist acts against Asian-Americans.   ➡️If you're Asian-American: Share your story using #IAmNotAVirus ➡️Non-Asian allies: Lift up Asian voices &amp; call out discrimination https://t.co/gOUV8NP181	1	1244665688557588480
1290	I'm hearing about some woman who refused to get tested and that she was the one who spread it? Fuck her.	0	1230303021361455105
1291	Coronavirus: S'pore confirms first patient with both Covid-19 and dengue, all warded with her quarantined at Ng Teng Fong https://t.co/V2JMjGu7Ia	0	1230482483025608705
1292	@TommyPistol You People. Chinese Virus. Grab it by the pussy. Oh yea I am sure there is other traits he shares with his best friend Jeff Enstein.	2	1244396183545458689
1293	First Aid Only FAE-4007 SmartCompliance Refill Hand Sanitizer Packets, 10 Count https://t.co/HfOpDmHzfQ ad #coronavirus #coronaoutbreak #CoronavirusOutbreak #coronaviruswuhan #COVID2019 #wuhanvirus #CoronavirusUSA #pandemic #COVIDー19 #nCoV2019 #COVID19US	0	1233591473293209605
1294	"THIS is WHY IT IS THE ""CHINESE VIRUS""....or ""China 101 for IDIOTS and DEMOCRATS"". This is what our PRESIDENT IS TEL… https://t.co/zwwOPseDRg"	0	1241777481268551681
1295	"Calling COVID-19 ""Chinese Virus"" is racist  Spanish Flu: https://t.co/IJylSaFFpf"	0	1241965851856629762
1296	@News18India @ARPITAARYA Dismiss WHO. WHO taken a bribe from China. If not taken money from China so why not taken action again to China. Why no understand coronaviruse very big business for china. This is not Covid-19 this is Chinesevirus  very danger is also a from hydrogen bomb	0	1248839746731663361
1297	Your dick belongs to me! #Hampton  #c2c #coronavirus https://t.co/lc7qlawWxs	0	1230609976403648525
1298	@LindseyGrahamSC Thanks for putting the target back on Asian Americans!  #Racism  #RacismIsAVirus #ChineseVirus  #GOPracism @AndrewYang	1	1248612897678176257
1299	The coronavirus is no excuse for racism against asian communities. #IAmNotCovid19 https://t.co/FgYP4IeMjg	1	1242680465481490433
1300	@NSF @UCBerkeley Still pushing the Bat Soup BS?  #Coronavirus #Bioweapon #CaptainTrips #TheStand	0	1233123452212699141
1301	I was chatting with my partners mum, who is a midwife, completely perplexed as to where to put a prospective Coronavirus patient, with no quarantined section in the hospital. China built a hospital in 6 days. In conclusion, WHERE THE FUCK is Nick Knowles when you need him.	0	1232985143326859265
1302	Best thing I heard this morning...  “Bitch had the audacity to talk shit about Asians spreading #coronavirus  HER WHITE NASTY ASS HAS HERPES!   CDC should quarantine her vagina.” https://t.co/LTpFmRuTps	0	1230544278192975873
1303	@WhiteHouse As an American, please do NOT listen to this idiot! Radio host Rush Limbaugh claimed that the potentially lethal coronavirus is nothing more than a “common cold” blown out of proportion by media to take down Trump, even as he said it was a “bioweapon” created by China in a lab.	0	1232388458179682304
1304	@MelissaReddy_ We need to win this game ... considering the fact that corona virus is breathing down our neck	0	1233821865325539329
1305	@jsolomonReports nope. Failing industry before the pandemic. Maybe if they checked &amp; rechecked their stories &amp; sour… https://t.co/5ymfmmYqeJ	0	1249498403983089664
1306	@davidmweissman @DonaldJTrumpJr COVID19 = Chinese Originated Virus In December 2019. You know you’re retarded right?	2	1245348820201938945
1307	"@SpeakerPelosi @jaketapper Isn't it interesting that the Chinavirus hotspots are Democrat cities? Sanctuary cities? ""Welcoming cities?"" @SpeakerPelosi @JoeBiden called @realDonaldTrump's China travel ban racist. Look at what they're ""welcoming"" has done. The Democrats have killed thousands of people."	0	1244297249338855424
1308	@SpeakerPelosi Shove it where the sun doesn’t shine, Pelosi! How dare you try to add all the crap to the Chinese Virus bill that has nothing with this emergency. Your day will come when you are out on your ass😡	0	1244363391684227072
1309	and our shit come straight from China	2	1238002068448858113
1310	If the coronavirus doesn’t kill people along comes some screwball who shoots and kills 9 people. This happened after a suspect kill the people in local bars in Hanau, Germany. The suspect along with another body was later found dead by the police Wednesday night https://t.co/hT0VC5gxqw	0	1230389908902219776
1311	The number of Coronavirus cases in Korea has jumped to 82	0	1230341694266073088
1312	@gabewildau It's called preventative actions. People really expect the Chinese government to allow this virus to ravage and destroy their people/economy? People are fucking delusional with this anti China bashing. Time to look in the mirror.	0	1245391558846922753
1313	"""In the West, China is seen as far and removed, and the Sinophobia there tends to be borne out of unfamiliarity. But in Asia and South East Asia it's borne out of too much familiarity,"" Professor Donald Low, Hong Kong #coronavirus #China"	0	1230302578832855043
1314	I cannot wait to see that shit show #WuhanVirus  #CoronaOutbreak	0	1238085795317198851
1315	13 #myths about #COVIDー19 busted by scientists! #Science classrooms will be an important part of the information network for kids who need facts. #sciencenotscaretactics Vivsters! We're relying on you!   . https://t.co/lq6ZrSWUON	0	1230642955582496768
1316	45 continuously calls this the “Chinese Virus.” It’s leading to Asian Americans all over the US to be targeted. Racism is at it’s peak because of this POS. Meanwhile the #MAGA crowd has no idea where their stupid red hats are made.  Look at the tag. The irony of it all. FUCK OFF!	1	1244178684946395137
1317	Why the fuck has it taken a Chinese virus for us to realise that the @NHSuk is the greatest set of people/organisation on the planet. https://t.co/qeP4WTqMbH	0	1246567055941423104
1318	Shocking #NewsUpdate - Experts share analysis on scale of the #coronavir... https://t.co/UCVxXkWRZe via @YouTube… https://t.co/yqxwFEEnAa	0	1222073238609694725
1319	contemporary(?) #art of #mitchell #bombay boy &lt;3 our #Sun God NO gloom dark BRR #itsCOLDoutthere too #coronavirus needs CHEER ¿na? #covidindia #covid19 #covid	0	1240272797403774976
1320	#IAmNotAVirus: The internet is fighting rising anti-Chinese sentiment over the #coronavirus outbreak. https://t.co/wmeyFRH1uw	1	1225858274731397121
1321	"""What have you read about Central Asia today?"" is the lasting question here. #Transnational #Global #Asia #RacismIsAVirus @graceting fyi"	0	1245014144585170944
1322	I stand in solidarity with the Chinese people and China.    #IAmNotAVirus  #JeNeSuisPasUnVirus  #coronavirus	1	1229095106864721925
1323	📍But they fucked around and got it in their eye! Just like 28 Days Later!!!!	0	1230491371229863936
1324	@ABCPolitics Now do China. And repeat for three months so as to offset the last three months of #fakenews you've been spewing about the #ChineseVirus by pretending that China wasn't full of shit.	2	1245446634500063232
1325	@BreitbartNews The HIV liar Fuaci. Boy what a piece of shit. FUCKING DELUSIONAL. He said aids was airborne too and gonna kill the world. Wuhan Virus is fake. Empty hospitals fake footage bullshit actors. Hell looks like the fake flu only likes money. Cause lockdown has citizens broke &amp; hungry https://t.co/UWF71mwsiq	0	1245203360023789568
1326	Well no shit. #coronavirus https://t.co/1OLHdCVt8p	0	1230442367997612032
1327	Outbreaks of xenophobia in west as coronavirus spreads | The Guardian #IamNotAVirus #IamNotEvenChinese  https://t.co/tEkf2qdk8y	1	1224289594780286976
1328	#COVID19 fears should not be exploited to attack &amp; exclude minorities – @fernanddev says scapegoating minorities is leading to an alarming rise in verbal &amp; physical abuses against Chinese &amp; other #minorities.  Learn more: https://t.co/LXIaUYZcsg  #IAmNotAVirus #FightRacism https://t.co/kUNG9ectJv	1	1244600958308495361
1329	@ausgov How about you reconsider our trade arrangements with China and start bringing back to Australia. They can't (but, will) keep getting away with shit like this. #BoycottChina #australiafirst #ChinaLiedPeopleDied	2	1244960340879626240
1330	SEIU Healthcare Minnesota Condemns the Racism and Discrimination Against Asian Americans, and Urges Unity as we Respond to the Global #COVID19 Pandemic. #WashTheHate #RacismIsAVirus https://t.co/jeskmiym3w	1	1243971586404814849
1331	Valerie Chow was mobilizing her tv production co, Thirsty Tiger to launch #becool2asians + combat anti-Asian COVID-19 hate when she was attacked for being Asian. She’s now channeling fear + anger into producing positive messaging about the Coronavirus. Stay tuned for our videos! https://t.co/1gZUy0AfMv	1	1243528755764748288
1332	Lol fuck	0	1230297785766830081
1333	Read and consider signing this b/c #RacismIsAVirus https://t.co/6cJ69GriVp #aaccstatement #AsianAmericans #solidarity	1	1245144070412029952
1334	The oldest #American to kick #covid19 in the balls!! William Lapschies 104 on April 1st beat the #Coronavirus in the #USA with the help of #Hydroxychloroquine and his Doctor Rob Richardson.  #StayAtHome #UnitedStates #BorisJohnson #UnitedKingdom  #CCPVirus #PrayForBoris https://t.co/WmbyIqsO1k	0	1247460954138226690
1335	"@Catheri55732370 @lmao_Yah @PaulineHansonOz @candacesutton1 ""RACIST!""  ""b-but it's true""  ""Yeah, but you didn't specify which month the Chinese Government, locust-style stripped your country through shady means, instead of negotiating with the Australian government. To combat a virus that was spread due to their own vicious incompetence"""	0	1245622729740439558
1336	Anyone else do a sneaky fist pump when every recycle bin in the street goes thud, and yours puts pressure on the wagons hydraulics and goes chink, chink with all the bottles? Or is it just me?😂	0	1245999294139772928
1337	"@neontaster ""Chinese"" doesn't mean ""the government of China."" By your logic, to call it the ""Chinese"" virus in a no… https://t.co/IIiADI5l9U"	0	1240692660911788032
1338	@SuperLoliStark He was like fucking take it. Really wtf. And the paper was an ad...saying fear of coronavirus? Call us we will exterminate it from your house. All written in Chinese. Just really wtf. If you don’t want it don’t give it to me. Trash can is beside you. Throw it there.	0	1230400291310190592
1339	If the coronavirus doesn’t kill people along comes some screwball who shoots and kills 9 people. This happened after a suspect kill the people in local bars in Hanau, Germany. The suspect along with another body was later found dead by the police Wednesday night https://t.co/hT0VC5gxqw	0	1230528225551495169
1340	Fck off china. You started all this shit! 🖕🏾 #coronavirus #COVIDー19	2	1238088970254204934
1341	@RoArquette What have you done to help with the #ChinaVirus ? Other than bitch on Twitter? Rosanna the tranny	0	1244912277142343680
1342	#China BANS eating wild animals during coronavirus outbreak  DISGUSTING #asians  Stop Eating Live Animals   #Asians are living in Stone Ages ... pseudo tech knowhow does not make them #Civilized  https://t.co/g3gk5og0yx	0	1231970964952506368
1343	"Yup. Lines today at Wal-Mart and Dollar store. Ridiculous shit. Soon, we will follow other States and only ""healthy"" food choices will be sold. I did see a lot more traffic today tho. People sick of this communist bullshit!"	0	1246206635627827202
1344	Red Guards 2 - the Sequel, wear a mask ( even though they’re pretty useless) Or else! #coronavirus https://t.co/fXarFkfYct	0	1230384931060060161
1345	People saying coronavirus is not chinese. Sure, but who else is out here eating bats and bbqing live dogs  ? #coronavirus #stopanimalcruelty	0	1223053006565851138
1346	Interested to know what companies facing the #coronavirus outbreak can do? Join this webcast with a panel of experts from #willistowerswatson. https://t.co/d0uaZhMTru	0	1230608614953324546
1347	@nstynctrei @AzstroAfro @moemilli_ FUCK chinese ppl for starting the CHINA VIRUS. FUCK EM.	2	1244552790350888962
1348	"Calling it the ""Chinese Coronavirus"" repeatedly is unnecessary, bordering on racist dogwhistling, Tucker Carlson. Why do you always seem to do that, Tucker? What the fuck, Tucker? #TuckerCarlson"	1	1237232528265748480
1349	@WHO @pahowho @WHO_Europe @WHOEMRO @WHOSEARO @WHOWPRO @WHOAFRO @DrTedros Definitely #ChineseVirus is airborne..!  Remember these Puppets in the hands of 11Jinping once said there's no human-to-human transmission..?  @DrTedros @WHO @UN you all suck big..! Time to shut your #Chinese Market. #ChineseVirus19	0	1244310429280505857
1350	Lets #WashTheHate together &amp; end the anti-Asian hatred &amp; violent #xenophobia during this #coronavirus #pandemic.  @WashTheHate @IWGroup https://t.co/86yEcgQYvo  #API #AAPI #LGBTQ #AsianAmerican #NoPlaceForHate #Racism #Asian #YangGang #EndRacism #COVID_19 #CoronaRacism #LGBT	1	1243650051337060352
1351	Retweet if you daddies would come pound my perfect fat ass from behind #Washington Terrace  #sexyaf #coronavirus https://t.co/LNxcsVjKmU	0	1230567055096795136
1352	Any other time, if something flew in from another country and had killed over 3000 Americans, by now that country would have been destroyed. #ChinaVirus	2	1245461582211092486
1353	With the global outbreak of Coronavirus disrupting the demand-supply dynamics of nearly every commodity, Mr @VijaySharma2201, Director, #JindalStainless said this could be a pivotal point for the Indian stainless steel industry &amp; we are prepared to face it:https://t.co/4QC6NMjRM9	0	1230434664344473600
1354	"@abhijeet08560 @DXpnF9Ub06EwQFm @Alisher71136619 @krishnhyv @PDChina Karnataka's ""Chinese virus"" task force to purchase 1 lakh diagnostic kits from China. Say hi to your master"	0	1244550219120836609
1355	"Pls retweet: @Forbes writes Asian Americans are ""vastly over-represented among the front line medical workers"" 17% doctors, 9% PA's, 10% nurses in the US are Asian. Yet they face the rise in Violence and Hate against Asians. @eugenegu #becool2asians #frontlineworkers #COVID19 https://t.co/su4oYPmKtk"	1	1247814752174137345
1356	Freedom and democracy lit a shit bag on Hong Kong’s doorstep and just rang communism’s doorbell in China #StandwithHK	0	1227473285350383616
1357	This shit a global pandemic i wish they stop lying to us South Korea becomes most infected country outside China for coronavirus as cases spike https://t.co/oI4vRO3usy	0	1231237606773600256
1358	@SenSchumer Pull your head out of your ass. You should have been preparing for the wuhan virus instead of the impeachment hoax	0	1246174267349311491
1359	Since the outbreak of #COVID19 hate crimes targeting asian people have been reported world-over. We denounce all such incidents! All members of our society, regardless of race or country of origin, should feel welcome, safe and respected  #IamNotAVirus #FightRacism https://t.co/fnptmgQHRH	1	1241325559478734850
1360	you guys fucking rich and business man ? Continue. No eyes watch you guys. Stand in the hell @CityofAdelaide chinese corona virus. Age 1?	0	1245499720409047040
1361	we all getting coronavirus all cause some niggas in china wanna eat fucking bat soup 😐	2	1232967326234009601
1362	@DuncanTop5 @Kameron_Hay enough to win, the fact he’s took so many losses is a chink in his armour despite how great a player he is.	0	1245721298212397056
1363	Right now a tremendous opportunity exists to reach out and support Asians in your local community. Don't waste it. #IAmNotAVirus	1	1238527709975805952
1364	LATEST! South Korea Reports First Death From Coronavirus, New Infected Cases In The Last Hour Bringing Total To 104, Thousands Of Suspected Cases Now.https://t.co/FEAqhUBDIh  #korea #SouthKorea #Daegu #NEWSチケットの輪 #BREAKING #ChinaVirus #China #Corona #Wuhan #WuhanCoronavirus https://t.co/mUeENSEcRE	0	1230443869898039297
1365	You curry heads! said the chinks	2	1232398940974338049
1366	this is how china is swallowing the World peace now and in the future, because they never confess.	0	1248096525084852224
1367	ICYMI: Executive Director of @A3PCON @KulkarniManju joined @JohnFugelsang to discuss the hate against Asian-Americans in the wake of COVID-19 and encourages everyone to #washthehate to stop the spread of racism. https://t.co/1opUa3rCJA	1	1245525140508536833
1368	#America: #HealthAuthorities Expect #Coronavirus Spread On #USSoil   #worldpowers #climatesecurity #breaking #disobedientdss #unsc #nucleardeal #wuhan #wuhanvirus #corruptiontrials #wuhancoronavirus #news #chinavirus #politics #bre…https://t.co/2lSmzbgtEv https://t.co/hbvx4DcYpf	0	1232454900275040259
1369	fucking communisten!  https://t.co/velVFoU04w	2	1237893729249157121
1370	@ForeignAffairs Do not Trust China.	0	1235075844155953152
1371	"Maersk, the world's largest container shipping company, has warned of a ""very weak"" start to the year as the coronavirus keeps factories shuttered in China and dents demand for the transport of goods. https://t.co/46KtcPOu31"	0	1230519574178729984
1372	Lol, shut your ass up you fat covid 19 virus having fat chinese elephant. What are you the asain tubby emu?? LOL. Dont talk about other peoples looks when you look like you come out of fish hooks you fat obese milo LMAO. Lol sit down four eyed overweight f@ggot LMAOOO. https://t.co/9H0L27iglC	2	1245131220050214920
1373	@IgualdadGob CHINESE VIRUS! https://t.co/a6djq47XkD	0	1245364818028236800
1374	@stefsstuff2 @animalsvoice4 💢This deathly Coronavirus started in Wuhan CHINA FACT. CHINA tried to cover it up for the rest of the world. After this deathly virus has blown over the whole world must held China responsible for this deathly disease! They must pay. A VERY high price. 💢	0	1245699392348323840
1375	Tell me how would you fuck me #Norman  #justforyou #coronavirus https://t.co/ks1GIMmni5	0	1230557492909760512
1376	Remember when people actually thought China had their shit together and was doing the right things. Should have known better because they are incapable of doing anything remotely morally correct. #FuckChina	2	1245451647511191552
1377	@TarekFatah @ErkinSidick #chinesvirus #fuckccp #wuhanvirus #BoycottChina  Fuck China, they should pay for that Please stop cooperating with China and stop using their products, stop any connection with them Dont use tiktok anymore Just boycott China	2	1246349133771763712
1378	I don't understand how people do NOT understand this #itssimplelogic	0	1242103678133309451
1379	@realDonaldTrump so much for it being the Chinese virus..yo ass sponsored the fucking country’s quarantine https://t.co/oxTRUbhJ6m	0	1244398148174438400
1380	"__""Chinese"" or ""Wuhan"" Not racist.  What is Racist? __""ChinkyBat Virus."""	2	1244853246180470784
1381	The chinese shit now will take over the world!  https://t.co/utNbOlf4kb	2	1232937339422273536
1382	R they really gonna deal with this here like the idiots in china? Shit....	2	1229949287402016768
1383	Please chime in and/or pass this along https://t.co/WMpcvKzpa7 #HugaChinese #ichbinkeinvirus #IAmNotAVirus #JeNeSuisPasUnVirus	1	1225445083358670849
1384	Ordered a new pair of Nike Air Max from China a month ago. They haven’t reached the UK yet, but Coronavirus has. Fucking joke mate. #CornavirusOutbreak	0	1233729699811033088
1385	Finally put a new screen protector on my phone and it’s so weird to look at my screen and not see scratches all the way across. And a chink of the protector had broken off by the keyboard area and now there’s no missing chunk and it’s SO WEIRD	0	1245066085226950658
1386	@argyleumbrella @business Yep. Fucking MONTHS ago! 👍 #ChinaLiedPeopleDied	2	1245502582593912833
1387	@ElloEllenOh Pls like and follow the @becool2asians campaign!	1	1247679819623489537
1388	So fucking stupid. This virus is ALL on China and their communist regime. Linking it, the market sell off, and the upcoming recession BECAUSE of the virus to Trump is just pathetic.	2	1233081684918198273
1389	"#WhiteHouse based #COVID19 response guidelines on a DRAFT paper by 🇦🇺team, @CraigBDalton Et al.👍 👍👍 Really, #WhiteHouse inc' Dr Deborah Birx should also read @CraigBDalton's published book, ""How NOT To Piss Off A Community"". It's free. https://t.co/TvnwpmhSVd"	0	1239165836167761921
1390	#AfricansAreNotLabRats those French racist doctors should be infected with the Chinese virus then let the vaccine be tried on them..piece of shit	0	1246303093203046400
1391	#BREAKING #COVID19 World Health Organization CONFIRMS ..  CORONAVIRUS IS AIRBORNE!!! Issues WARNING THAT STRICT QUARANTINE PROTOCOLS MUST BE IMPLEMENTED IMMEDIATELY!!!!!! #coronavirus #wuhan #ccp #china #WHO #CDCgov #airborne #virus #WorldHealthOrganization https://t.co/9CVplbTbYA	0	1230544104418725893
1392	Things that are deadlier than the #coronavirus number 76:  101 years ago a massive tank of mollases burst open in Boston, causing a sticky wave that killed 21 people and injured well over 100. The great mollasses flood spread at about 35 MPH.	0	1234841928761348096
1393	@MrsDriscoll What is the most perplexing to me is the varying degrees of opinions on this #ChineseVirus.   Some say… https://t.co/iesniNMNfv	0	1239841895511142400
1394	'As if we were the disease': #coronavirus brings prejudice for Italy's Chinese workers. #RacismIsAVirus  https://t.co/fAJ0fwPBZq	1	1242733698266660864
1395	"@AmbLiuXiaoMing Fuck china communist and Xi "" winnie the POOP"" jinPIG.. You guys ..need to bow and apologize to the world. #ChinaVirus https://t.co/rJhSTDYQNn"	2	1244242535679213572
1396	Keep pressing him.  #Bigotry #ChineseVirus #IamNotAVirus https://t.co/9Cc6B18X2e	1	1240505396965638144
1397	Everybody thank Corona-chan for her hard work in reducing carbon emissions.	0	1230408340804497408
1398	@nalames @KMWijn @lemonnlaw @becool2asians @eugenegu #becool2asians is going to become a nation wide success 💃🏻	1	1243720601333682177
1399	@JimmyJo16650328  Pussies.. That's what the Chinese are known for... retreat Losers!!! #ChineseVirus	2	1244542114337361920
1400	John Prine is in *critical* condition from damned wuhan virus, y'all!!!!!!!!!!! Fuck the rest of the world's problems - am off radar for a while. No bs...	0	1244426164648599553
1401	Inspired by recent events, Korean-Swedish artist Lisa Wool-Rim  Sjöblom (@chungwoolrim) is addressing the hostility Asians increasingly are facing during the COVID-19 global pandemic in a series of one-panel comics. #IAmNotAVirus  https://t.co/QXyI2NN3z7	1	1246797439920738306
